<?xml version='1.0' encoding='UTF-8'?>
<?xml-stylesheet media="screen"              title="Dictionary view"   href="../../giella-core/dicts/scripts/gt_dictionary_XXE.css"     type="text/css"?>
<?xml-stylesheet media="screen"              title="Hierarchical view" href="../../giella-core/dicts/scripts/gt_dictionary_XXE_alt.css" type="text/css" alternate="yes" ?>
<?xml-stylesheet media="print,tv,projection" title="Dictionary view"   href="../../giella-core/dicts/scripts/gt_dictionary.css"         type="text/css"?>
<?xml-stylesheet media="print,tv,projection" title="Hierarchical view" href="../../giella-core/dicts/scripts/gt_dictionary_alt.css"     type="text/css" alternate="yes" ?>
<!DOCTYPE r PUBLIC "-//DivvunGiellatekno//DTD Dictionaries//Multilingual" "../scripts/dict_smnfin.dtd">
<r id="smnfin" xml:lang="smn">
   <lics xml:space="preserve">
  <lic xml:lang="en">
This code is made available under a Creative Commons Attribution license
<a>http://creativecommons.org/licenses/by/3.0/no/deed.en</a>.

You are free to copy, distribute and adapt the work, as long as you always give
proper attribution using the attribution text below.

For the full license text, see the link above.
</lic>
<ref>Work by Marja-Liisa Olthuis and Taarna Valtonen, and by Giellatekno at UiT,
          and members of the language communities. Source code
          available at <a>https://victorio.uit.no/langtech/trunk/</a>.</ref><sourcenote>
     THIS TEXT IS THE ORIGINAL SOURCE CODE. This is NOT a fully styled and
     published dictionary. As such it can and
     will contain unfinished entries, unpublished entries, entries with
     objectionable translations, etc. If you find any errors or want to add more
     words, download the file, edit it, and send it back to
     <a>mailtofeedback@divvun.no</a> and <a>mailtogiellatekno@hum.uit.no</a>.
     Please also note that the entries are not necessarily sorted,
     or could be wrongly sorted.
     </sourcenote></lics>
   <e id="Clt_1">
      <lg>
         <l pos="Clt">râk</l>
      </lg>
      <mg rest="">
         <tg xml:lang="fin">
            <t pos="Clt">-pa ~ -pä</t>
         </tg>
      </mg>
   </e>
   <e id="CC_5">
      <lg>
         <l pos="Clt">-ge</l>
      </lg>
      <mg rest="">
         <tg xml:lang="fin">
            <t pos="Clt">-ka ~ -kä</t>
         </tg>
      </mg>
   </e>
  </r>
